{
  "schema_version": "video-content/media-plan-v1",
  "project_id": "content_0123456789abcdef",
  "source_manifest_sha256": "aaaaaaaaaaaaaaaaaaaaaaaaaaaaaaaaaaaaaaaaaaaaaaaaaaaaaaaaaaaaaaaa",
  "content_map_sha256": "bbbbbbbbbbbbbbbbbbbbbbbbbbbbbbbbbbbbbbbbbbbbbbbbbbbbbbbbbbbbbbbb",
  "communication_goal": "让没有时间看视频的人理解核心观点及其边界",
  "audience": "对主题有轻度兴趣但时间有限的人",
  "content_topology": {
    "argument_depth": "medium",
    "context_dependency": "medium",
    "visual_potential": "high",
    "uncertainty_level": "low"
  },
  "selected_medium": "one_page",
  "selection_authority": "user_selected",
  "selection_reason": "两个核心观点可以在单页中形成问题—原则结构。",
  "adaptation_strategy": {
    "relationship_to_source": "reconstructed_for_medium",
    "rationale": "单页先给结论，再合并解释与边界，不复刻视频时间顺序。",
    "transformations": ["重排论点", "合并解释", "把限定贴近所约束的结论"]
  },
  "narrative_voice": {
    "mode": "source_author",
    "speaker_ids": ["speaker-0001"],
    "description": "以讲述者的直接口吻表达，不添加外部转述框架。",
    "prohibited_wrappers": ["这个视频认为", "作者表示"]
  },
  "alternatives": [
    {
      "medium": "article",
      "rejected_because": "示例论证较短，不需要长文展开。"
    }
  ],
  "required_claim_ids": ["claim-0001", "claim-0002"],
  "required_caveat_ids": ["caveat-0001"],
  "omissions": [],
  "structure": [
    {
      "unit_id": "unit-0001",
      "purpose": "呈现问题",
      "claim_ids": ["claim-0001"],
      "caveat_ids": [],
      "visual_direction": "用门槛图形表现观看成本",
      "approximate_chars": 40
    },
    {
      "unit_id": "unit-0002",
      "purpose": "呈现转换原则与边界",
      "claim_ids": ["claim-0002"],
      "caveat_ids": ["caveat-0001"],
      "visual_direction": "用证据链表现可追溯关系",
      "approximate_chars": 80
    }
  ],
  "rendering_contract": {
    "format": "svg",
    "tone": "克制、清晰、非营销",
    "length_or_dimensions": "1080x1440",
    "accessibility": ["正文不小于32px", "颜色不是唯一编码"]
  },
  "fidelity_rules": [
    "不得新增视频未表达的结论",
    "必须保留字幕证据不等于事实核验的限定"
  ]
}
